<?xml version="1.0" encoding="UTF-8"?>

<SanityChecker_output xmlns:xsi="http://www.w3.org/2001/XMLSchema-instance" xmlns="SanityChecker_Output" xmlns:SanityChecker="SanityChecker_Output" xsi:schemaLocation="SanityChecker_Output SanityChecker_Output.xsd">
  <file_summary>
    <metadata_lines>2</metadata_lines>
    <data_lines>50</data_lines>
    <metadata_message_counts>
      <critical>0</critical>
      <error>1</error>
      <unrecognised>3</unrecognised>
    </metadata_message_counts>
    <data_message_counts>
      <critical>0</critical>
      <error>12</error>
      <warning>22</warning>
      <lines_with_errors>12</lines_with_errors>
      <lines_with_warnings>15</lines_with_warnings>
    </data_message_counts>
  </file_summary>
  <metadata_messages>
   <message severity="warning">
     <type>Unrecognised</type>
     <properties>
       <name>Wind measurer thingy height</name>
     </properties>
     <line>1</line>
   </message>
   <message severity="warning">
     <type>Out of range</type>
     <properties>
       <name>intake_depth</name>
       <min>0</min>
       <max>20</max>
     </properties>
     <line>1</line>
   </message>
  </metadata_messages>
  <column_summary>
    <column pos="1" name="Latitude" errors="1" warnings="2">
      <message severity="error">
          <type>Missing</type>
          <count>1</count>
      </message>
      <message severity="warning">
        <type>Out of range</type>
        <properties>
          <min>-90</min>
          <max>90</max>
        </properties>
        <count>2</count>
      </message>
    </column>
    <column pos="2" name="Longitude" errors="1" warnings="2">
    </column>
  </column_summary>
  <data_messages>
    <message severity="error">
      <type>Missing</type>
      <line>5</line>
      <column pos="3">Date</column>
    </message>
    <message severity="warning">
      <type>Out of range</type>
      <properties>
        <min>25</min>
        <max>40</max>
      </properties>
      <line>12</line>
      <column pos="13">Salinity</column>
    </message>
  </data_messages>
</SanityChecker_output>
